{
  "$schema": "./tags.schema.json",
  "methodology": "DFC Bridge",
  "schemaVersion": "1.0.0",
  "description": "Canonical registry of DFC Bridge layer-name tags and the boundary with structured Figma metadata and namespaced bridge contracts.",
  "statusLevels": [
    "stable",
    "experimental",
    "deprecated"
  ],
  "scopeLevels": [
    "page-root",
    "variant-root",
    "layer",
    "control",
    "field",
    "target",
    "collection",
    "item"
  ],
  "sourceOfTruthLevels": [
    "bridge-tag",
    "figma-metadata"
  ],
  "structuredMetadata": {
    "namespace": "bridge",
    "schema": "./bridge.schema.json",
    "rule": "Use layer tags only for compact transfer intent and identity anchors. Put data, responsive transformations, interaction graphs, motion, accessibility, and delivery lifecycle in the namespaced structured contract."
  },
  "tags": [
    {
      "key": "page",
      "title": {
        "en": "Page identity",
        "ru": "Идентификатор страницы",
        "zh": "页面标识"
      },
      "status": "stable",
      "authoredInLayerName": true,
      "sourceOfTruth": "bridge-tag",
      "scope": [
        "page-root"
      ],
      "form": "property",
      "value": {
        "kind": "kebab-case",
        "pattern": "^[a-z0-9]+(?:-[a-z0-9]+)*$"
      },
      "identityBearing": true,
      "companions": {
        "requires": [
          "bp",
          "view"
        ]
      },
      "notes": {
        "en": "A DFC Bridge page root always uses native Auto Layout and must never carry [asset]. It may sit directly on the Figma page or below native Figma SECTION canvas organizers; those organizers are transparent and contribute no DFC Bridge context.",
        "ru": "Корень страницы DFC Bridge всегда использует нативный Auto Layout и никогда не содержит [asset]. Он может лежать прямо на странице Figma или под нативными организаторами SECTION Figma; такие организаторы прозрачны и не передают контекст DFC Bridge.",
        "zh": "DFC Bridge 页面根始终使用本机自动布局并且绝不能携带 [asset]。它可以直接位于 Figma 页面上或本地 Figma SECTION 画布组织者下方；这些组织者是透明的，不会贡献 DFC Bridge 背景。"
      }
    },
    {
      "key": "route",
      "title": {
        "en": "Production route",
        "ru": "Рабочий маршрут",
        "zh": "生产路线"
      },
      "status": "stable",
      "authoredInLayerName": true,
      "sourceOfTruth": "bridge-tag",
      "scope": [
        "page-root"
      ],
      "form": "property",
      "value": {
        "kind": "route",
        "pattern": "^/(?:[^\\s?#]+/?)*(?:#[a-z0-9]+(?:-[a-z0-9]+)*)?$"
      },
      "identityBearing": false,
      "companions": {
        "requires": [
          "page"
        ],
        "conflicts": [
          "route-pattern"
        ]
      }
    },
    {
      "key": "route-pattern",
      "title": {
        "en": "Dynamic route pattern",
        "ru": "Шаблон динамического маршрута",
        "zh": "动态路线模式"
      },
      "status": "experimental",
      "authoredInLayerName": true,
      "sourceOfTruth": "bridge-tag",
      "scope": [
        "page-root"
      ],
      "form": "property",
      "value": {
        "kind": "route-pattern",
        "pattern": "^/(?:[^\\s?#]+/?)*:[a-z][a-z0-9-]*(?:/(?:[^\\s?#]+|:[a-z][a-z0-9-]*))*$"
      },
      "identityBearing": false,
      "companions": {
        "requires": [
          "page"
        ],
        "conflicts": [
          "route"
        ]
      }
    },
    {
      "key": "bp",
      "title": {
        "en": "Control width",
        "ru": "Контрольная ширина",
        "zh": "控制宽度"
      },
      "status": "stable",
      "authoredInLayerName": true,
      "sourceOfTruth": "bridge-tag",
      "scope": [
        "page-root"
      ],
      "form": "property",
      "value": {
        "kind": "positive-integer",
        "pattern": "^[1-9][0-9]*$"
      },
      "identityBearing": false,
      "companions": {
        "requires": [
          "page"
        ]
      }
    },
    {
      "key": "view",
      "title": {
        "en": "Page view",
        "ru": "Вид страницы",
        "zh": "页面浏览量"
      },
      "status": "stable",
      "authoredInLayerName": true,
      "sourceOfTruth": "bridge-tag",
      "scope": [
        "page-root"
      ],
      "form": "property",
      "value": {
        "kind": "kebab-case",
        "pattern": "^[a-z0-9]+(?:-[a-z0-9]+)*$"
      },
      "identityBearing": false,
      "companions": {
        "requires": [
          "page"
        ]
      }
    },
    {
      "key": "anchor",
      "title": {
        "en": "Anchor target",
        "ru": "Цель якоря",
        "zh": "锚定目标"
      },
      "status": "stable",
      "authoredInLayerName": true,
      "sourceOfTruth": "bridge-tag",
      "scope": [
        "layer"
      ],
      "form": "property",
      "value": {
        "kind": "kebab-case",
        "pattern": "^[a-z0-9]+(?:-[a-z0-9]+)*$"
      },
      "identityBearing": true,
      "companions": {}
    },
    {
      "key": "section",
      "title": {
        "en": "Page section identity",
        "ru": "Идентификатор секции",
        "zh": "页面区块标识"
      },
      "status": "stable",
      "authoredInLayerName": true,
      "sourceOfTruth": "bridge-tag",
      "scope": [
        "layer"
      ],
      "form": "property",
      "value": {
        "kind": "kebab-case",
        "pattern": "^[a-z0-9]+(?:-[a-z0-9]+)*$"
      },
      "identityBearing": true,
      "companions": {
        "conflicts": [
          "modal",
          "state",
          "field",
          "collection",
          "item",
          "form"
        ]
      },
      "notes": {
        "en": "A stable [section] value is the required boundary for Check selected section; never add page/bp/view/route tags to a section. A frame-built section or editable Page Sections source root uses native Auto Layout unless that exact selected root also carries [asset] and is a genuine opaque whole visual. A section nested below a different non-page-root opaque [asset] ancestor is an invalid blocked selection because the audit cannot pierce the inherited boundary. An invalid [asset] on a page root never creates opacity. Placed INSTANCE nodes are atomic and their source is audited separately.",
        "ru": "Стабильное значение [section] является обязательной границей для проверки выбранной секции; теги page/bp/view/route нельзя добавлять секции. Секция-фрейм или редактируемый исходный корень Page Sections использует нативный Auto Layout, кроме случая, когда сам выбранный корень также содержит [asset] и является настоящим непрозрачным цельным визуальным ресурсом. Секция под другим непрозрачным родительским [asset], не являющимся корнем страницы, является недопустимым заблокированным выбором: проверка не проходит сквозь унаследованную границу. Недопустимый [asset] на корне страницы никогда не создаёт непрозрачность. Размещённые INSTANCE атомарны, а их источник проверяется отдельно.",
        "zh": "稳定的[截面]值是检查所选截面所需的边界；切勿将 page/bp/view/route 标签添加到某个部分。框架构建的部分或可编辑的页面部分源根使用本机自动布局，除非该确切选定的根也带有[资产]并且是真正的不透明整体视觉效果。嵌套在不同的非页面根不透明[资产]祖先下面的部分是无效的阻止选择，因为审核无法穿透继承的边界。页面根目录上的无效[资源]永远不会产生不透明度。放置的 INSTANCE 节点是原子的，并且它们的源是单独审核的。"
      }
    },
    {
      "key": "href",
      "title": {
        "en": "Navigation destination",
        "ru": "Адрес перехода",
        "zh": "导航目的地"
      },
      "status": "stable",
      "authoredInLayerName": true,
      "sourceOfTruth": "bridge-tag",
      "scope": [
        "layer",
        "control"
      ],
      "form": "property",
      "value": {
        "kind": "href",
        "pattern": "^(?:/(?!/)[^\\s]*|#[a-z0-9]+(?:-[a-z0-9]+)*|https?://[^\\s]+|mailto:[^\\s@]+@[^\\s@]+|tel:\\+?[0-9() .-]+)$"
      },
      "identityBearing": false,
      "companions": {
        "conflicts": [
          "action"
        ]
      }
    },
    {
      "key": "link",
      "title": {
        "en": "Draft link or advanced link identity",
        "ru": "Черновая ссылка или расширенный идентификатор ссылки",
        "zh": "草稿链接或高级链接标识"
      },
      "status": "stable",
      "authoredInLayerName": true,
      "sourceOfTruth": "bridge-tag",
      "scope": [
        "layer",
        "control"
      ],
      "form": "boolean-or-property",
      "value": {
        "kind": "kebab-case",
        "pattern": "^[a-z0-9]+(?:-[a-z0-9]+)*$"
      },
      "identityBearing": true,
      "companions": {
        "conflicts": [
          "action",
          "control"
        ]
      },
      "notes": {
        "en": "Prefer [href=...] when the destination is known; the value form is an advanced override.",
        "ru": "Когда адрес известен, используйте [href=...]; форма со значением предназначена только для расширенного переопределения.",
        "zh": "当目的地已知时首选 [href=...]；值形式是高级覆盖。"
      }
    },
    {
      "key": "open",
      "title": {
        "en": "Link opening behavior",
        "ru": "Способ открытия ссылки",
        "zh": "链接打开行为"
      },
      "status": "stable",
      "authoredInLayerName": true,
      "sourceOfTruth": "bridge-tag",
      "scope": [
        "control"
      ],
      "form": "property",
      "value": {
        "kind": "enum",
        "enum": [
          "new-tab"
        ]
      },
      "identityBearing": false,
      "companions": {
        "requiresAny": [
          "href",
          "link"
        ]
      }
    },
    {
      "key": "a11y-label",
      "title": {
        "en": "Accessible control label",
        "ru": "Доступное название элемента управления",
        "zh": "无障碍控制标签"
      },
      "status": "stable",
      "authoredInLayerName": true,
      "sourceOfTruth": "bridge-tag",
      "scope": [
        "control"
      ],
      "form": "property",
      "value": {
        "kind": "human-text",
        "minLength": 1
      },
      "identityBearing": false,
      "companions": {
        "requiresAny": [
          "href",
          "link",
          "action",
          "control"
        ]
      }
    },
    {
      "key": "action",
      "title": {
        "en": "Non-navigation action",